{
  "schemaVersion": 1,
  "catalogueId": "console-acceptance-delivery-requirements-v1",
  "phases": {
    "preReviewRequirementIds": [
      "CONSOLE-AC-001", "CONSOLE-AC-002", "CONSOLE-AC-003", "CONSOLE-AC-004", "CONSOLE-AC-005",
      "CONSOLE-AC-006", "CONSOLE-AC-007", "CONSOLE-AC-008", "CONSOLE-AC-009", "CONSOLE-AC-010",
      "CONSOLE-AC-011", "CONSOLE-AC-012", "CONSOLE-AC-013", "CONSOLE-AC-014", "CONSOLE-AC-015",
      "CONSOLE-AC-016", "CONSOLE-AC-017", "CONSOLE-AC-018", "CONSOLE-AC-019", "CONSOLE-AC-020",
      "CONSOLE-AC-021", "CONSOLE-AC-022", "CONSOLE-AC-023", "CONSOLE-AC-024", "CONSOLE-AC-025",
      "CONSOLE-AC-026", "CONSOLE-AC-027", "CONSOLE-AC-028", "CONSOLE-AC-029", "CONSOLE-AC-030",
      "CONSOLE-AC-031", "CONSOLE-AC-032", "CONSOLE-AC-034", "CONSOLE-AC-035", "CONSOLE-AC-036",
      "CONSOLE-AC-037", "CONSOLE-AC-038", "CONSOLE-AC-039", "CONSOLE-AC-040", "CONSOLE-AC-041",
      "CONSOLE-AC-042", "CONSOLE-AC-043", "CONSOLE-AC-044", "CONSOLE-AC-045"
    ],
    "postReviewAcceptanceRequirementIds": ["CONSOLE-AC-033"]
  },
  "entries": [
    {
      "requirementId": "CONSOLE-AC-001",
      "sourceRole": "spec",
      "sourceRef": "console-acceptance-v1.13",
      "evidenceSelectors": [
        {
          "role": "test",
          "registryKind": "test-result.v1",
          "selectorId": "console-acceptance-test-console-protocol-inside-outside-herdr-v1",
          "cardinality": "complete-nonempty-current-set",
          "requiredStatus": "pass"
        }
      ]
    },
    {
      "requirementId": "CONSOLE-AC-002",
      "sourceRole": "spec",
      "sourceRef": "console-acceptance-v1.13",
      "evidenceSelectors": [
        {
          "role": "test",
          "registryKind": "test-result.v1",
          "selectorId": "console-acceptance-test-console-restart-active-work-v1",
          "cardinality": "complete-nonempty-current-set",
          "requiredStatus": "pass"
        }
      ]
    },
    {
      "requirementId": "CONSOLE-AC-003",
      "sourceRole": "spec",
      "sourceRef": "console-acceptance-v1.13",
      "evidenceSelectors": [
        {
          "role": "gate-decision",
          "registryKind": "review-gate-decision.v1",
          "selectorId": "console-acceptance-review-gate-console-10s-orientation-v1",
          "cardinality": "complete-nonempty-current-set",
          "requiredStatus": "approved"
        }
      ]
    },
    {
      "requirementId": "CONSOLE-AC-004",
      "sourceRole": "spec",
      "sourceRef": "console-acceptance-v1.13",
      "evidenceSelectors": [
        {
          "role": "test",
          "registryKind": "test-result.v1",
          "selectorId": "console-acceptance-test-consequential-gate-latency-projection-v1",
          "cardinality": "complete-nonempty-current-set",
          "requiredStatus": "pass"
        }
      ]
    },
    {
      "requirementId": "CONSOLE-AC-005",
      "sourceRole": "spec",
      "sourceRef": "console-acceptance-v1.13",
      "evidenceSelectors": [
        {
          "role": "test",
          "registryKind": "test-result.v1",
          "selectorId": "console-acceptance-test-authenticated-gate-input-confirmation-v1",
          "cardinality": "complete-nonempty-current-set",
          "requiredStatus": "pass"
        }
      ]
    },
    {
      "requirementId": "CONSOLE-AC-006",
      "sourceRole": "spec",
      "sourceRef": "console-acceptance-v1.13",
      "evidenceSelectors": [
        {
          "role": "test",
          "registryKind": "test-result.v1",
          "selectorId": "console-acceptance-test-minor-major-session-escalation-v1",
          "cardinality": "complete-nonempty-current-set",
          "requiredStatus": "pass"
        }
      ]
    },
    {
      "requirementId": "CONSOLE-AC-007",
      "sourceRole": "spec",
      "sourceRef": "console-acceptance-v1.13",
      "evidenceSelectors": [
        {
          "role": "test",
          "registryKind": "test-result.v1",
          "selectorId": "console-acceptance-test-dynamic-topology-authority-v1",
          "cardinality": "complete-nonempty-current-set",
          "requiredStatus": "pass"
        }
      ]
    },
    {
      "requirementId": "CONSOLE-AC-008",
      "sourceRole": "spec",
      "sourceRef": "console-acceptance-v1.13",
      "evidenceSelectors": [
        {
          "role": "test",
          "registryKind": "test-result.v1",
          "selectorId": "console-acceptance-test-persisted-gate-enforcement-dependencies-v1",
          "cardinality": "complete-nonempty-current-set",
          "requiredStatus": "pass"
        }
      ]
    },
    {
      "requirementId": "CONSOLE-AC-009",
      "sourceRole": "spec",
      "sourceRef": "console-acceptance-v1.13",
      "evidenceSelectors": [
        {
          "role": "test",
          "registryKind": "test-result.v1",
          "selectorId": "console-acceptance-test-command-idempotency-stale-diff-v1",
          "cardinality": "complete-nonempty-current-set",
          "requiredStatus": "pass"
        }
      ]
    },
    {
      "requirementId": "CONSOLE-AC-010",
      "sourceRole": "spec",
      "sourceRef": "console-acceptance-v1.13",
      "evidenceSelectors": [
        {
          "role": "test",
          "registryKind": "test-result.v1",
          "selectorId": "console-acceptance-test-writer-scope-worktree-exclusion-v1",
          "cardinality": "complete-nonempty-current-set",
          "requiredStatus": "pass"
        }
      ]
    },
    {
      "requirementId": "CONSOLE-AC-011",
      "sourceRole": "spec",
      "sourceRef": "console-acceptance-v1.13",
      "evidenceSelectors": [
        {
          "role": "test",
          "registryKind": "test-result.v1",
          "selectorId": "console-acceptance-test-git-authority-consequential-gates-v1",
          "cardinality": "complete-nonempty-current-set",
          "requiredStatus": "pass"
        }
      ]
    },
    {
      "requirementId": "CONSOLE-AC-012",
      "sourceRole": "spec",
      "sourceRef": "console-acceptance-v1.13",
      "evidenceSelectors": [
        {
          "role": "test",
          "registryKind": "test-result.v1",
          "selectorId": "console-acceptance-test-github-absence-outage-freshness-v1",
          "cardinality": "complete-nonempty-current-set",
          "requiredStatus": "pass"
        }
      ]
    },
    {
      "requirementId": "CONSOLE-AC-013",
      "sourceRole": "spec",
      "sourceRef": "console-acceptance-v1.13",
      "evidenceSelectors": [
        {
          "role": "test",
          "registryKind": "test-result.v1",
          "selectorId": "console-acceptance-test-identity-reconciliation-launch-ambiguity-v1",
          "cardinality": "complete-nonempty-current-set",
          "requiredStatus": "pass"
        }
      ]
    },
    {
      "requirementId": "CONSOLE-AC-014",
      "sourceRole": "spec",
      "sourceRef": "console-acceptance-v1.13",
      "evidenceSelectors": [
        {
          "role": "test",
          "registryKind": "test-result.v1",
          "selectorId": "console-acceptance-test-operator-action-audit-journal-v1",
          "cardinality": "complete-nonempty-current-set",
          "requiredStatus": "pass"
        }
      ]
    },
    {
      "requirementId": "CONSOLE-AC-015",
      "sourceRole": "spec",
      "sourceRef": "console-acceptance-v1.13",
      "evidenceSelectors": [
        {
          "role": "test",
          "registryKind": "test-result.v1",
          "selectorId": "console-acceptance-test-safe-full-message-rendering-v1",
          "cardinality": "complete-nonempty-current-set",
          "requiredStatus": "pass"
        }
      ]
    },
    {
      "requirementId": "CONSOLE-AC-016",
      "sourceRole": "spec",
      "sourceRef": "console-acceptance-v1.13",
      "evidenceSelectors": [
        {
          "role": "test",
          "registryKind": "test-result.v1",
          "selectorId": "console-acceptance-test-console-mutation-capability-matrix-v1",
          "cardinality": "complete-nonempty-current-set",
          "requiredStatus": "pass"
        }
      ]
    },
    {
      "requirementId": "CONSOLE-AC-017",
      "sourceRole": "spec",
      "sourceRef": "console-acceptance-v1.13",
      "evidenceSelectors": [
        {
          "role": "test",
          "registryKind": "test-result.v1",
          "selectorId": "console-acceptance-test-conversational-approval-provenance-v1",
          "cardinality": "complete-nonempty-current-set",
          "requiredStatus": "pass"
        }
      ]
    },
    {
      "requirementId": "CONSOLE-AC-018",
      "sourceRole": "spec",
      "sourceRef": "console-acceptance-v1.13",
      "evidenceSelectors": [
        {
          "role": "test",
          "registryKind": "test-result.v1",
          "selectorId": "console-acceptance-test-daemon-start-attach-project-concurrency-v1",
          "cardinality": "complete-nonempty-current-set",
          "requiredStatus": "pass"
        }
      ]
    },
    {
      "requirementId": "CONSOLE-AC-019",
      "sourceRole": "spec",
      "sourceRef": "console-acceptance-v1.13",
      "evidenceSelectors": [
        {
          "role": "test",
          "registryKind": "test-result.v1",
          "selectorId": "console-acceptance-test-control-lifecycle-restart-reconciliation-v1",
          "cardinality": "complete-nonempty-current-set",
          "requiredStatus": "pass"
        }
      ]
    },
    {
      "requirementId": "CONSOLE-AC-020",
      "sourceRole": "spec",
      "sourceRef": "console-acceptance-v1.13",
      "evidenceSelectors": [
        {
          "role": "test",
          "registryKind": "test-result.v1",
          "selectorId": "console-acceptance-test-notification-dedup-delivery-focus-v1",
          "cardinality": "complete-nonempty-current-set",
          "requiredStatus": "pass"
        }
      ]
    },
    {
      "requirementId": "CONSOLE-AC-021",
      "sourceRole": "spec",
      "sourceRef": "console-acceptance-v1.13",
      "evidenceSelectors": [
        {